Name,Url,"Creation Date","Last Update","Last Version",Omeka.org,"Omeka Constraint",Author,"Author Link",License,Description,Tags,Link,"Support Link","Ini Path"
"Advanced Search Plus",https://github.com/Daniel-KM/Omeka-S-module-AdvancedSearchPlus,2018-05-21T06:31:55Z,2018-05-21T19:51:59Z,3.0.1,,^1.0.0,"Daniel Berthereau",https://github.com/Daniel-KM,"CeCILL v2.1","Add some fields to the advanced search form (before/after creation date, has media, etc.).","search, admin, curation",https://github.com/Daniel-KM/Omeka-S-module-AdvancedSearchPlus,https://github.com/Daniel-KM/Omeka-S-module-AdvancedSearchPlus/issues,
"Analytics Snippet",https://github.com/Daniel-KM/Omeka-S-module-AnalyticsSnippet,2017-11-13T14:19:42Z,2018-06-25T13:00:46Z,3.0.0,,^1.0.0,"Daniel Berthereau",https://github.com/Daniel-KM,"CeCILL v2.1","Add a snippet, generally a javascript tracker, at the end of the public or admin pages, and allows to track json and xml requests.","seo, tracking, analytics, statistics",https://github.com/Daniel-KM/Omeka-S-module-AnalyticsSnippet,https://github.com/Daniel-KM/Omeka-S-module-AnalyticsSnippet/issues,
"Analytics Snippet - Piwik / Matomo",https://github.com/Daniel-KM/Omeka-S-module-AnalyticsSnippetPiwik,2017-11-13T14:40:01Z,2018-06-25T13:01:43Z,3.0.0,,^1.0.0,"Daniel Berthereau",https://github.com/Daniel-KM,"CeCILL v2.1","Submodule for Analytics Snippet to track json (in particular Omeka S API) and xml (like with OAI-PMH Repository) calls with Piwik / Matomo.","seo, tracking, analytics, statistics",https://github.com/Daniel-KM/Omeka-S-module-AnalyticsSnippetPiwik,https://github.com/Daniel-KM/Omeka-S-module-AnalyticsSnippetPiwik/issues,
Annotate,https://github.com/Daniel-KM/Omeka-S-module-Annotate,2018-05-08T16:20:14Z,2018-06-25T10:06:20Z,3.0.0,,^1.0.0,"Daniel Berthereau",https://github.com/Daniel-KM,CECILL-2.1,"Implement the W3C Web Annotation Ontology to let users annotate, tag, comment, rate, highlight, draw, etc. any resource in a normalized way.","annotation, tag, comment, rating, w3c recommendation, linked data",https://github.com/Daniel-KM/Omeka-S-module-Annotate,https://github.com/Daniel-KM/Omeka-S-module-Annotate/issues,
"Archive Folder",https://github.com/biblibre/omeka-s-module-ArchiveFolder,2016-03-24T16:04:23Z,2016-03-29T17:05:54Z,2.4,,,"Daniel Berthereau",,,"Automatically import a local or remote folder into Omeka as collections, items, files, and metadata.",,https://github.com/Daniel-KM/ArchiveFolder,,
"Archive Repertory",https://github.com/Daniel-KM/Omeka-S-module-ArchiveRepertory,2017-03-28T11:16:01Z,2018-06-18T06:10:18Z,3.15.5,,^1.0.0,"Daniel Berthereau, Omeka S port by BibLibre",https://github.com/Daniel-KM,"CeCILL v2.1","Keeps original names of imported files and put them in a hierarchical structure (collection / item / files) in order to get readable urls for files and to avoid an overloading of the file server.","file, path, import",https://github.com/Daniel-KM/Omeka-S-module-ArchiveRepertory,https://github.com/Daniel-KM/Omeka-S-module-ArchiveRepertory/issues,
Ark,https://github.com/biblibre/omeka-s-module-Ark,2016-09-14T12:19:28Z,2018-03-28T14:12:02Z,0.1.1,,>=v1.0.0-beta3,BibLibre,https://github.com/biblibre,,"Create short, unique, meaningless, universal and persistent identifiers (ark and/or noid) and use them as urls for records.",,https://github.com/biblibre/omeka-s-module-Ark,,
Base,https://github.com/pols12/omeka-s-module-Base,2018-07-18T10:56:42Z,2018-07-18T11:00:22Z,0.1.0,,,Pols12,http://github.com/pols12,,"Base of a module to execute a script.",,,,
Basket,https://github.com/biblibre/omeka-s-module-Basket,2016-09-20T14:39:48Z,2017-12-13T17:58:00Z,0.2.0,,,,,,"Allow user to add basket",,https://github.com/biblibre/Basket,,
"Clean Url",https://github.com/Daniel-KM/Omeka-S-module-CleanUrl,2017-04-04T11:42:23Z,2018-07-30T06:11:02Z,3.15.5,,^1.0.0,"Daniel Berthereau, Omeka S port by BibLibre",https://github.com/Daniel-KM,"CeCILL v2.1","Displays clean, seo and readable URLs like https://example.org/first_collection/dc:identifier.","url, route, SEO",https://github.com/biblibre/omeka-s-module-CleanUrl,https://github.com/biblibre/omeka-s-module-CleanUrl/issues,
COinS,https://github.com/biblibre/omeka-s-module-Coins,2016-03-15T15:20:50Z,2017-11-08T08:26:02Z,2.0.3,,,"Roy Rosenzweig Center for History and New Media (Omeka S port by BibLibre)",https://chnm.gmu.edu/,GPLv3,"Adds COinS metadata to item pages, making them Zotero readable.","metadata, zotero",https://github.com/biblibre/omeka-s-module-Coins,,
Collecting,https://github.com/omeka-s-modules/Collecting,2015-07-30T23:23:08Z,2017-12-14T20:25:49Z,1.0.0,,^1.0.0,"Roy Rosenzweig Center for History & New Media",http://rrchnm.org/,,"Add collecting forms to your sites.",,,https://forum.omeka.org/c/omeka-s/modules,
Comment,https://github.com/Daniel-KM/Omeka-S-module-Comment,2018-01-08T09:30:19Z,2018-07-02T05:25:49Z,3.1.5,,^1.1.0,"Daniel Berthereau (port and improvement from the RRCHNM Omeka Classic plugin)",https://github.com/Daniel-KM,"CeCILL v2.1","Add public and/or private commenting on item sets, items and media and manage them.","comment, public interaction, crowdsourcing",https://github.com/Daniel-KM/Omeka-S-module-Comment,https://github.com/Daniel-KM/Omeka-S-module-Comment/issues,
"CSS Editor",https://github.com/biblibre/omeka-s-module-CSSEditor,2016-03-16T17:55:26Z,2018-07-05T10:15:36Z,1.0.1,,,"Roy Rosenzweig Center for History and New Media",,,"Add public CSS styles through the admin interface.",,http://omeka.org/codex/Plugins/CSS_Editor,,
"CSS Editor",https://github.com/daniel-km/omeka-s-module-CSSEditor,2018-07-04T09:08:18Z,2018-07-09T05:26:32Z,3.0.1,,^1.1.0,"Roy Rosenzweig Center for History and New Media, upgraded by BibLibre and Daniel Berthereau",https://github.com/Daniel-KM,GPL-3.0,"Add public CSS styles through the admin interface.","theme, customization, css",https://github.com/Daniel-KM/Omeka-S-module-CSSEditor,https://github.com/Daniel-KM/Omeka-S-module-CSSEditor/issues,
"CSV Import",https://github.com/omeka-s-modules/CSVImport,2015-07-30T23:24:12Z,2018-07-13T19:39:47Z,1.1.0,,^1.0.0,"Roy Rosenzweig Center for History & New Media",http://rrchnm.org/,,"Import content from a CSV file.",,,https://forum.omeka.org/c/omeka-s/modules,
"Custom Advanced Search",https://github.com/omeka-s-modules/CustomAdvancedSearch,2017-12-20T21:31:59Z,2017-12-20T21:33:07Z,0.0.1,,^1.0.0,"Roy Rosenzweig Center for History & New Media",http://rrchnm.org/,,"Customize the advanced search form",,,https://forum.omeka.org/c/omeka-s/modules,
"Custom Ontology",https://github.com/Daniel-KM/Omeka-S-module-CustomOntology,2018-03-05T11:01:05Z,2018-05-04T12:51:42Z,3.0.2,,^1.0.0,"Daniel Berthereau",https://github.com/Daniel-KM,"CeCILL v2.1","Create specific classes and properties to describe resources when no standard ontologies can be used.","ontology, vocabulary, class, property",https://github.com/Daniel-KM/Omeka-S-module-CustomOntology,https://github.com/Daniel-KM/Omeka-S-module-CustomOntology/issues,
"Custom Vocab",https://github.com/omeka-s-modules/CustomVocab,2016-01-26T17:52:19Z,2018-06-11T04:45:51Z,1.0.0,,^1.0.0,"Roy Rosenzweig Center for History & New Media",http://rrchnm.org/,,"Describe your resources using vocabularies you create.",,,https://forum.omeka.org/c/omeka-s/modules,
"Dspace Connector",https://github.com/omeka-s-modules/DspaceConnector,2015-03-02T23:56:03Z,2017-12-14T20:26:48Z,1.0.0,,^1.0.0,"Roy Rosenzweig Center for History & New Media",http://rrchnm.org/,,"Connect Omeka S to DSpace repositories.",,,https://forum.omeka.org/c/omeka-s/modules,
"Easy Install",https://github.com/Daniel-KM/Omeka-S-module-EasyInstall,2017-03-06T13:24:17Z,2018-03-20T20:34:27Z,3.2.1,,^1.0.0,"Daniel Berthereau",https://github.com/Daniel-KM,"CeCILL v2.1","Module for installing modules and themes from the web (https://github.com and https://gitlab.com).","utility, admin",https://github.com/Daniel-KM/Omeka-S-module-EasyInstall,https://github.com/Daniel-KM/Omeka-S-module-EasyInstall/issues,
"Exploratory Map",https://github.com/coreytegeler/omeka-s-module-ExploratoryMap,2018-03-15T03:26:28Z,2018-04-24T00:29:55Z,1.0,,,"Corey Tegeler",http://coreytegeler.com,,,,http://coreytegeler.com,,
"Extract Ocr",https://github.com/bubdxm/Omeka-S-module-ExtractOcr,2018-05-24T12:08:43Z,2018-06-06T12:09:26Z,1.0,,,bubdxm,https://github.com/symac,,"This omeka module allow creation of xml files from pdf using pdftohtml. The xml is stored as a new file associated with the item. (Upgrade From",,http://github.com/bubdxm/Omeka-S-module-ExtractOcr,,
"Fedora Connector",https://github.com/omeka-s-modules/FedoraConnector,2015-04-03T17:25:30Z,2018-05-15T17:29:40Z,1.0.0,,^1.0.0,"Roy Rosenzweig Center for History & New Media",http://rrchnm.org/,,"Connect Omeka S to Fedora 4 repositories.",,,https://forum.omeka.org/c/omeka-s/modules,
"File Sideload",https://github.com/omeka-s-modules/FileSideload,2015-07-30T23:24:30Z,2018-06-25T07:23:49Z,1.0.1,,^1.2.0-alpha.2,"Roy Rosenzweig Center for History & New Media",http://rrchnm.org/,,"Add files that are already on your server to items.",,,https://forum.omeka.org/c/omeka-s/modules,
Folksonomy,https://github.com/Daniel-KM/Omeka-S-module-Folksonomy,2017-05-08T04:31:56Z,2018-07-09T04:35:09Z,3.3.8,,^1.1.0,"Daniel Berthereau",https://github.com/Daniel-KM,"CeCILL v2.1","Add tags and tagging form to any resource to create uncontrolled vocabularies and tag clouds.","tag, contribution, folksonomy, tagging",https://github.com/Daniel-KM/Omeka-S-module-Folksonomy,https://github.com/Daniel-KM/Omeka-S-module-Folksonomy/issues,
"Google Analytics",https://github.com/digirati-co-uk/omeka-google-analytics-module,2017-06-26T13:40:22Z,2018-07-03T16:02:23Z,1.0.1,,^1.0.0,Digirati,https://github.com/digirati-co-uk,,"Omeka-S module for adding Google Analytics tracking code",,https://github.com/digirati-co-uk/omeka-google-analytics-module,,
Group,https://github.com/Daniel-KM/Omeka-S-module-Group,2018-01-08T05:18:35Z,2018-07-21T11:26:24Z,3.0.3,,^1.1.0,"Daniel Berthereau",https://github.com/Daniel-KM,"CeCILL v2.1","Add groups to users and resources to manage the access rights and the resource visibility in a more flexible way.","administration, group, rights",https://github.com/Daniel-KM/Omeka-S-module-Group,https://github.com/Daniel-KM/Omeka-S-module-Group/issues,
"Guest User",https://github.com/biblibre/omeka-s-module-GuestUser,2016-05-18T09:55:10Z,2018-01-10T17:48:16Z,0.1.2,,>=1.0.0-beta5,Biblibre,https://github.com/biblibre,"CeCILL v2.1","Adds a guest user role. Can’t access backend, but allows plugins to use an authenticated user.","authentication, front-end",https://github.com/biblibre/omeka-s-module-GuestUser,https://github.com/biblibre/omeka-s-module-GuestUser/issues,
"Hide Properties",https://github.com/zerocrates/HideProperties,2018-04-06T00:18:37Z,2018-04-06T00:19:29Z,1.0.0,,^1.1.0,"John Flatness",https://github.com/zerocrates,GPLv3,,,https://github.com/zerocrates/HideProperties,https://github.com/zerocrates/HideProperties/issues,
IdRef,https://github.com/biblibre/omeka-s-module-IdRef,2016-09-13T09:26:03Z,2017-11-08T08:23:14Z,0.1.0,,,BibLibre,https://github.com/biblibre,,"Add IdRef data type",,https://github.com/biblibre/omeka-s-module-IdRef,,
IIIFHosting,https://github.com/klokantech/omeka-s-module-IIIFHosting,2017-05-09T15:14:10Z,2017-08-10T16:49:20Z,1.0.0-beta,,^1.0.0-beta3,Klokantech,http://www.klokantech.com/,,"IIIFHosting connector",,,https://github.com/klokantech/omeka-s-module-IIIF,
IiifSearch,https://github.com/bubdxm/Omeka-S-module-IiifSearch,2018-05-18T14:00:13Z,2018-06-05T14:38:37Z,1.0,,,bubdxm,https://github.com/bubdxm,,"Search api for universal viewer module.",,https://github.com/bubdxm/Omeka-S-module-IiifSearch,,
"IIIF Server",https://github.com/Daniel-KM/Omeka-S-module-IiifServer,2017-03-06T12:04:44Z,2018-06-18T06:23:36Z,3.5.10,,^1.0.0,"Daniel Berthereau, Omeka S port by BibLibre",https://github.com/Daniel-KM,"CeCILL v2.1","Integrates the IIIF specifications and a simple IIP Image Server to allow to process and share instantly images of any size and medias (pdf, audio, video, 3D...) in the desired formats.","specification, standard, share",https://github.com/Daniel-KM/Omeka-S-module-IiifServer,https://github.com/Daniel-KM/Omeka-S-module-IiifServer/issues,
"Item Sets Tree",https://github.com/biblibre/omeka-s-module-ItemSetsTree,2016-06-10T09:57:50Z,2017-03-08T12:09:31Z,2.0.2,,,"Roy Rosenzweig Center for History and New Media",,,"Gives administrators the ability to create a hierarchical tree of their collections.",,http://omeka.org/codex/Plugins/CollectionTree_2.0,,
jQueryUI,https://github.com/biblibre/omeka-s-module-jQueryUI,2016-05-12T13:52:19Z,2018-03-07T08:10:53Z,1.12.1,,,BibLibre,https://github.com/biblibre,,"Provides jQueryUI for other modules",,https://github.com/biblibre/omeka-s-module-jQueryUI,,
Ldap,https://github.com/digihum/omeka-s-ldap,2016-12-12T11:24:57Z,2017-04-03T16:20:02Z,0.2,,^1.0.0-beta2,"Tim Hollies",http://warwick.ac.uk/digitalhumanities,,"Authenticate Omeka-S users with LDAP",,,,
Lockout,https://github.com/Daniel-KM/Omeka-S-module-Lockout,2017-06-08T10:19:00Z,2018-07-05T15:07:38Z,3.2.3,,^1.0.0,"Daniel Berthereau (port of Johan Eenfeldt's plugin for WordPress)",https://github.com/Daniel-KM,"CeCILL v2.1","Limit rate of login attempts for each IP to avoid brute-force attacks.","login, security, authentication",https://github.com/Daniel-KM/Omeka-S-module-Lockout,https://github.com/Daniel-KM/Omeka-S-module-Lockout/issues,
Log,https://github.com/Daniel-KM/Omeka-S-module-Log,2018-01-08T06:43:53Z,2018-07-29T07:28:05Z,3.1.4,,^1.0.0,"Daniel Berthereau",https://github.com/Daniel-KM,CECILL-2.1,"Monitor all logging messages and background jobs directly in the admin board and make them translatable and easily checkable.","monitor, log, psr-3, logging, job, admin",https://github.com/Daniel-KM/Omeka-S-module-Log,https://github.com/Daniel-KM/Omeka-S-module-Log/issues,
Maintenance,https://github.com/Daniel-KM/Omeka-S-module-Maintenance,2017-11-14T12:13:27Z,2018-01-15T07:09:40Z,3.0.2,,^1.0.0,"Daniel Berthereau",https://github.com/Daniel-KM,"CeCILL v2.1","Add a setting to set the site under maintenance for the public. Can be disabled when unused.","administration, miscellaneous",https://github.com/Daniel-KM/Omeka-S-module-Maintenance,https://github.com/Daniel-KM/Omeka-S-module-Maintenance/issues,
Mapping,https://github.com/omeka-s-modules/Mapping,2016-03-16T20:35:19Z,2018-06-25T07:14:39Z,1.0.1,,^1.0.0,"Roy Rosenzweig Center for History & New Media",http://rrchnm.org/,,"Add location info to your items and sites.",,,https://forum.omeka.org/c/omeka-s/modules,
"Metadata Browse",https://github.com/omeka-s-modules/MetadataBrowse,2015-07-30T23:23:54Z,2018-04-23T21:12:30Z,1.1.2,,^1.0.0,"Roy Rosenzweig Center for History & New Media",http://rrchnm.org/,,"Adds a link to same results for metadata values.",,https://github.com/omeka-s-modules/MetadataBrowse,https://forum.omeka.org/c/omeka-s/modules,
My,https://github.com/AlyxTaj/dictionnaire-module-omeka,2018-05-01T14:19:35Z,2018-05-01T14:24:56Z,1.0,,^1.0.0,"My Organization",http://sortiaria.alwaysdata.net/omeka-s/s/sortiaria/page/accueil,,"Module dictionnaire pour Omeka-S",,https://github.com/AlyxTaj/module-dictionnaire-omeka.git,,
Neatline,https://github.com/performant-software/neatline-omeka-s,2018-01-12T01:59:43Z,2018-07-27T20:27:57Z,3.0.1,,,"Scholars' Lab",https://github.com/scholarslab/Neatline/issues,"Apache License, Version 2.0","Plot your course in space and time.",,https://github.com/scholarslab/Neatline,,
"Network Map",https://github.com/coreytegeler/omeka-s-module-NetworkMap,2018-04-02T15:13:14Z,2018-04-02T16:02:56Z,1.0,,,"Corey Tegeler",http://coreytegeler.com,,,,http://coreytegeler.com,,
"OAI-PMH Harvester",https://github.com/ddean4040/Omeka-S-module-OaiPmhHarvester,2018-02-08T16:50:56Z,2018-02-08T16:57:32Z,0.1,,^1.0.0,"David Dean - based on code from Roy Rosenzweig Center for History & New Media and Daniel Berthereau",,"GNU/GPL v3","Harvest content from an OAI-PMH repository.","harvest, bulk import, oai, aggregator",,,
"OAI-PMH Repository",https://github.com/biblibre/omeka-s-module-OaiPmhRepository,2016-12-15T16:20:39Z,2018-07-30T06:08:18Z,0.2.2,,,BibLibre,https://github.com/biblibre,,"Exposes Omeka items as an OAI-PMH repository.",,https://github.com/biblibre/omeka-s-module-OaiPmhRepository,,
"OAI Pmh Harvester",https://github.com/Numerizen/OaiPmhHarvester,2017-12-26T15:39:36Z,2018-07-21T07:00:19Z,0.1,,^1.0.0,"Vincent Buard for PSL",http://omeka.numerizen.com,,"Harvest OaiPmh repositories.",,,,
"Omeka 2 Importer",https://github.com/omeka-s-modules/Omeka2Importer,2015-07-14T16:42:23Z,2018-04-23T21:11:42Z,1.1.0,,^1.0.0,"Roy Rosenzweig Center for History & New Media",http://rrchnm.org/,,"Import content from an Omeka 2 site via its API.",,,https://forum.omeka.org/c/omeka-s/modules,
"Omeka Starter Kit",https://github.com/stephenwf/omeka-module-starter-kit,2017-03-31T12:27:08Z,2017-09-27T17:19:26Z,1.0,,^1.0.0,"Stephen Fraser",https://github.com/stephenwf,,"Developer friendly example of Omeka module",,https://github.com/stephenwf/omeka-module-starter-kit,,
"Omeka Twig",https://github.com/digihum/omeka-s-twig,2017-01-06T10:13:46Z,2017-01-06T10:14:17Z,0.2.0,,^1.0.0-beta,"Tim Hollies",http://warwick.ac.uk/digitalhumanities,,"Use twig templates in Omeka-S themes",,,,
"ORCID Connector",https://github.com/omeka-s-modules/OrcidConnector,2018-05-02T20:28:12Z,2018-07-27T20:48:21Z,1.0.0,,^1.1.0,"Roy Rosenzweig Center for History and New Media",,,"Connect users and their content to ORCID data",,,,
"PDF Embed",https://github.com/zerocrates/PdfEmbedS,2017-07-20T00:05:02Z,2017-12-08T02:47:26Z,1.0.0,,^1.0.0,"John Flatness",https://github.com/zerocrates,,"Embed PDF files within Omeka S pages",,https://github.com/zerocrates/PdfEmbedS,https://github.com/zerocrates/PdfEmbedS/issues,
PdfText,https://github.com/Numerizen/PdfText,2017-12-26T15:38:06Z,2018-07-21T06:46:31Z,1.0,,,"Vincent BUARD",http://omeka.numerizen.com,,"Extract data from PDF files for indexation",,http://github.com/pdftext,,
PdfToc,https://github.com/bubdxm/Omeka-S-module-PdfToc,2018-05-29T12:16:21Z,2018-06-11T08:10:30Z,1.0,,,"bubdxm, bases PDF TOC plugin omeka",https://github.com/symac,,"Extracts table of contents from PDF files",,http://github.com/bubdxm/Omeka-S-module-PdfToc,,
Psl,https://github.com/biblibre/omeka-s-module-Psl,2016-12-20T13:07:23Z,2018-06-04T09:07:25Z,0.1.0,,,BibLibre,https://github.com/biblibre,,"Various things specific to PSL",,https://github.com/biblibre/omeka-s-module-Psl,,
PslSearchForm,https://github.com/biblibre/omeka-s-module-PslSearchForm,2016-06-15T14:33:57Z,2018-05-05T08:13:39Z,0.2.0,,,BibLibre,,,"PSL search form",,https://github.com/biblibre/omeka-s-module-PslSearchForm,,
Reference,https://github.com/Daniel-KM/Omeka-S-module-Reference,2018-02-21T18:31:39Z,2018-07-09T04:43:46Z,3.4.10,,^1.1.0,"Daniel Berthereau",https://github.com/Daniel-KM,"CeCILL v2.1","Adds glossary pages and blocks with the alphabetical indexes of specified classes and properties.","glossary, tree view, indexing, lexicon",https://github.com/Daniel-KM/Omeka-S-module-Reference,https://github.com/Daniel-KM/Omeka-S-module-Reference/issues,
RestrictedSites,https://github.com/ManOnDaMoon/omeka-s-module-RestrictedSites,2018-03-28T14:52:49Z,2018-03-28T17:08:23Z,0.4,,,"Laurent Thomas",manondamoon.com,,"Restricts access of public sites to the user list defined in site settings. Displays a login landing page for anonymous users.",,manondamoon.com,,
"Rights Statements",https://github.com/zerocrates/RightsStatements,2016-04-15T03:26:29Z,2017-12-08T02:16:58Z,0.3.0,,^1.0.0,"John Flatness",https://github.com/zerocrates,,,,https://github.com/zerocrates/RightsStatements,https://github.com/zerocrates/RightsStatements/issues,
Scripto,https://github.com/omeka-s-modules/Scripto,2017-11-17T20:22:19Z,2018-07-26T15:35:09Z,0.1.0-alpha,,^1.2.0-alpha.2,"Roy Rosenzweig Center for History & New Media",http://rrchnm.org/,,"Transcribe and translate items.",,,https://forum.omeka.org/c/omeka-s/modules,
Search,https://github.com/biblibre/omeka-s-module-Search,2016-04-29T12:07:18Z,2018-06-19T07:52:57Z,0.4.0,,>=1.0.0,BibLibre,https://github.com/biblibre,,"Add search capabilities to Omeka S",,https://github.com/biblibre/omeka-s-module-Search,,
Search,https://github.com/Daniel-KM/omeka-s-module-Search,2016-04-29T12:07:18Z,2018-06-04T09:08:16Z,0.5.5,,^1.1.0,"BibLibre, improved by Daniel Berthereau",https://github.com/biblibre,,"Add search capabilities to Omeka S",,https://github.com/biblibre/omeka-s-module-Search,,
Sharing,https://github.com/omeka-s-modules/Sharing,2015-12-15T16:44:26Z,2017-12-14T20:29:33Z,1.0.0,,^1.0.0,"Roy Rosenzweig Center for History & New Media",http://rrchnm.org/,,"Share and embed content on the web",,,https://forum.omeka.org/c/omeka-s/modules,
"Simple Block",https://github.com/zerocrates/SimpleBlock,2018-06-21T17:26:54Z,2018-06-21T21:17:34Z,0.1.0,,^1.1.0,"John Flatness",https://github.com/zerocrates,,,,https://github.com/zerocrates/SimpleBlock,https://github.com/zerocrates/SimpleBlock/issues,
Solr,https://github.com/biblibre/omeka-s-module-Solr,2016-04-29T12:11:55Z,2018-06-22T10:40:39Z,0.4.0,,>=1.0.0,BibLibre,https://github.com/biblibre,,"Add Solr search adapter",,https://github.com/biblibre/omeka-s-module-Solr,,
Solr,https://github.com/Daniel-KM/omeka-s-module-Solr,2018-01-08T09:54:45Z,2018-06-04T09:09:49Z,0.5.4,,^1.1.0,"BibLibre, improved by Daniel Berthereau",https://github.com/biblibre,CECILL-2.1,"Add Solr search adapter","Solr, Lucene, search, facet, filter, indexation, autocompletion",https://github.com/biblibre/omeka-s-module-Solr,https://github.com/biblibre/omeka-s-module-Solr/issues,
STest,https://github.com/patrickmj/STest,2016-10-11T17:47:05Z,2016-10-18T21:26:43Z,1.0.0,,,"Patrick Murray-John",,,"Test a bunch of random stuff",,,,
Storymap,https://github.com/agile-humanities/agile-storymap,2018-04-11T15:35:35Z,2018-06-01T18:47:24Z,3.4.4,,^1.0.0,"Alan Stanley",https://github.com/Daniel-KM,"CeCILL v2.1","Integrate the Knightlab Storymap to create advanced storymaps from the geocordinates of items.","storymap, chronology",https://github.com/agile-humanities/agile-storymap,https://github.com/agile-humanities/agile-storymap/issues,
Timeline,https://github.com/Daniel-KM/Omeka-S-module-Timeline,2017-04-19T05:47:33Z,2018-07-03T08:48:13Z,3.4.7,,^1.1.0,"Daniel Berthereau",https://github.com/Daniel-KM,"CeCILL v2.1","Integrate the Simile Timeline and the Knightlab Timeline to create advanced timelines from the dates of items.","timeline, chronology, data visualization",https://github.com/Daniel-KM/Omeka-S-module-Timeline,https://github.com/Daniel-KM/Omeka-S-module-Timeline/issues,
unAPI,https://github.com/omeka-s-modules/UnApi,2015-02-24T23:19:35Z,2018-06-18T06:33:24Z,1.0.0,,^1.0.0,"Roy Rosenzweig Center for History & New Media",http://rrchnm.org/,,"Make your item metadata discoverable using unAPI.",,,https://forum.omeka.org/c/omeka-s/modules,
"Universal Viewer",https://github.com/Daniel-KM/Omeka-S-module-UniversalViewer,2017-02-23T20:39:20Z,2018-05-28T05:39:11Z,3.5.7,,^1.0.0,"Daniel Berthereau, Omeka S port by BibLibre",https://github.com/Daniel-KM,"CeCILL v2.1","Integrates the Universal Viewer in order to create carousels of virtual books from image files and to display any media file (pdf, audio, video, 3D...) in a unified player.","viewer, book, digital library",https://github.com/Daniel-KM/Omeka-S-module-UniversalViewer,https://github.com/Daniel-KM/Omeka-S-module-UniversalViewer/issues,
"Upgrade from Omeka Classic",https://github.com/Daniel-KM/Omeka-S-module-UpgradeFromOmekaClassic,2017-02-14T15:56:31Z,2018-06-25T04:57:13Z,3.1.1,,^1.1.0,"Daniel Berthereau",https://github.com/Daniel-KM,"CeCILL v2.1","Add a compatibility layer to use Omeka Classic themes that were upgraded via the plugin Upgrade to Omeka Semantic.","omeka theme, compatibility layer",https://github.com/Daniel-KM/Omeka-S-module-UpgradeFromOmekaClassic,https://github.com/Daniel-KM/Omeka-S-module-UpgradeFromOmekaClassic/issues,
"Value Suggest",https://github.com/omeka-s-modules/ValueSuggest,2016-08-01T19:01:05Z,2018-05-28T05:19:05Z,1.1.0,,^1.0.0,"Roy Rosenzweig Center for History & New Media",http://rrchnm.org/,,"Describe your resources using auto-suggested values from controlled vocabulary services.",,,https://forum.omeka.org/c/omeka-s/modules,
"Zotero Import",https://github.com/omeka-s-modules/ZoteroImport,2015-02-05T21:58:10Z,2018-05-30T20:44:23Z,1.0.0,,^1.0.0,"Roy Rosenzweig Center for History & New Media",http://rrchnm.org/,,"Import items and files from Zotero user and group libraries.",,,https://forum.omeka.org/c/omeka-s/modules,
